{
  "kind": "cineweave_codex_continuity_ledger",
  "contractVersion": "2.2.0",
  "ledgerId": "ledger.rain-courtyard-v1",
  "version": 1,
  "storyRef": {
    "kind": "cineweave_codex_story_brief",
    "id": "story.rain-courtyard",
    "version": 1,
    "contentHash": "sha256:bbbbbbbbbbbbbbbbbbbbbbbbbbbbbbbbbbbbbbbbbbbbbbbbbbbbbbbbbbbbbbbb"
  },
  "skillReceipt": {
    "repository": "https://github.com/Wilder1222/cineweave-director",
    "ref": "v3.1.0",
    "commit": "0123456789abcdef0123456789abcdef01234567",
    "installedBy": "codex-environment",
    "usedAt": "2026-08-21T01:15:00.000Z"
  },
  "entries": [
    {
      "entryId": "continuity.evidence-seal",
      "entityType": "prop",
      "entityId": "prop.case-evidence",
      "factPath": "seal.status",
      "value": "完好",
      "sourceRefs": [
        {
          "kind": "cineweave_codex_script_scene",
          "id": "script-scene.rain-courtyard-confrontation",
          "version": 1,
          "contentHash": "sha256:cccccccccccccccccccccccccccccccccccccccccccccccccccccccccccccccc"
        }
      ],
      "validFrom": "beat.pressure",
      "validUntil": "beat.choice",
      "status": "active"
    }
  ],
  "conflicts": [],
  "validation": {
    "exactSources": true,
    "noSilentOverwrite": true,
    "blockingConflictsVisible": true
  }
}
